"conversation_id_str","created_at","favorite_count","full_text","id_str","image_url","in_reply_to_screen_name","lang","location","quote_count","reply_count","retweet_count","tweet_url","user_id_str","username"
"1804069815453389286","Fri Jun 21 08:32:16 +0000 2024","13","in my au kalo sabito hidup habis final battle dia kehilangan satu mata. : aku dipandang sebelah mata terus 'bit : SAMA SIAPA???? MANA ORANGNYA ... : anjing lo gi : hehehehehehe tolol ah","1804069815453389286","","","in","homophobic dni.","0","1","2","https://x.com/memoriikaw/status/1804069815453389286","1742881771124060160","memoriikaw"
"1803821812989690322","Thu Jun 20 16:06:48 +0000 2024","4","nemu tdi pagi di fb ah orng random tolol barusan di grup kontrakan nanyain adek tingkat yg lagi rame kasus plagiat namanya rico(ntol) kek mirip sm yg gw liat tdi pagi dah trus cek lagi ke fb nama tiktodnya rico anying deting tolol konten tugas smua plagiat mana folnya 300k","1803821812989690322","","","in","Sumsap","0","1","0","https://x.com/fajarfadilas/status/1803821812989690322","1350645382569553920","fajarfadilas"
"1800014849591963932","Mon Jun 10 03:59:17 +0000 2024","16408","dikit-dikit nangis ky org tolol anjir","1800014849591963932","","","in","GMT +7","696","438","6926","https://x.com/Azijik/status/1800014849591963932","875792932963364864","Azijik"
"1803712526359953638","Thu Jun 20 08:52:32 +0000 2024","10","Bacot banget western awokwowkw postingan gini masih punya opini tolol. Pedo ya kamu aowkwowk njir wibu wibu https://t.co/oymMihYPYZ","1803712526359953638","https://pbs.twimg.com/media/GQgS-tOaYAAO1HW.jpg","","in","pernikahan dengan gilbert","0","3","0","https://x.com/rikkaichy/status/1803712526359953638","1544155323421691910","rikkaichy"
"1803441640415379803","Wed Jun 19 15:07:36 +0000 2024","150","08. cemburu tanda tolol https://t.co/jOL4nFJny0","1803444529380606363","https://pbs.twimg.com/media/GQcfH5OaIAAMzg-.jpg","newyeomu","in","space💫","1","1","0","https://x.com/newyeomu/status/1803444529380606363","1486973741183938562","newyeomu"
"1770743423655452992","Thu Mar 21 09:25:05 +0000 2024","3693","Lah supir truk waras dikata tolol ente aja mental kagetan lagu-laguan ngebut &amp; cornering https://t.co/p9YvsiOsXB","1770743423655452992","https://pbs.twimg.com/ext_tw_video_thumb/1770743368026394625/pu/img/l9mWZvHvZ0fcfyaV.jpg","","in","","192","1021","789","https://x.com/sopir_idiot/status/1770743423655452992","1371302456336863235","sopir_idiot"
"1803713763117343035","Thu Jun 20 08:57:27 +0000 2024","33","WOI LUCU BGT KELIATAN TOLOL NYA WKWKWKWKKQ https://t.co/uDHpa8nTXv","1803713763117343035","https://pbs.twimg.com/media/GQgUG9bawAALScC.jpg","","in","","1","3","0","https://x.com/caellpedia/status/1803713763117343035","1321801664886571015","caellpedia"
"1804043152413855757","Fri Jun 21 06:46:19 +0000 2024","538","SM TOLOL!!! DIA FIGHT SENDIRI LOH SAMA SSG NYA DAN LO GA NGAPA-NGAPAIN HARUSNYA LO YG MINTA MAAF SAMA RJ KARENA GABISA KASIH DIA PERLINDUNGAN!!!!! SM PLEASE PROTECT YOUR ARTIST!!! #SMtakeactionforRenjun https://t.co/uPQOwaYXmi","1804043152413855757","https://pbs.twimg.com/media/GQk_rPuakAIn2qQ.jpg","","in","Indonesia","7","17","132","https://x.com/itsyellowfiy/status/1804043152413855757","596327166","itsyellowfiy"
"1804149157231497604","Fri Jun 21 13:47:33 +0000 2024","4","GUE ADUIN LU KE KESAYANGN KESAYANGN GUE YAA hiks hiks gue dimarahin hiks SIAPAPUN RNB AKUN TOLOL INI https://t.co/NPQ9o5aopD","1804149157231497604","https://pbs.twimg.com/media/GQmgF6FaAAA7Nqb.jpg","","in","Republic of Korea","0","10","0","https://x.com/keTuAmApiAaa/status/1804149157231497604","1635837203732656128","keTuAmApiAaa"
"1721220114367025475","Sun Nov 05 17:37:08 +0000 2023","22275","kliling sndiri biar cpt laku https://t.co/QVx0vtMp2K","1721220114367025475","https://pbs.twimg.com/ext_tw_video_thumb/1721220080976171008/pu/img/1o5oOCEzG-Ph_asq.jpg","","in","","853","662","6237","https://x.com/ketololan_tolol/status/1721220114367025475","1286878661493190657","ketololan_tolol"
"1803435014295789988","Wed Jun 19 14:29:48 +0000 2024","11","Cewek hijab cringe X pikmi emg combo wombo tolol yg pernah ada di Alam Semesta anjgggg. Gara2 lu yg lenjeh2 bisa bikin 1 nyawa Manusia Hilang dgn gampangnya. PIKMI PIKMI... MATI KEK LU SMUA CWEK PIKMI DIMUKA BUMI BANGSATTT TOLOLLL https://t.co/lsoNIoa2sk","1803435014295789988","https://pbs.twimg.com/media/GQcWlkobsAAWoFo.jpg","","in","Kota Batam, Kepulauan Riau","0","0","2","https://x.com/ryorosmei11/status/1803435014295789988","214871257","ryorosmei11"
"1804047377235623940","Fri Jun 21 07:03:06 +0000 2024","6","WKWKWK ANANG HERMANSYAH ANJENGGGG SHER TOLOL NGAKAK BGT FAK https://t.co/6jre36Mydh","1804047377235623940","https://pbs.twimg.com/media/GQlDhnqakAIl42H.jpg","","in","","0","3","2","https://x.com/mightbesus99/status/1804047377235623940","1721454709859639296","mightbesus99"
"1803557505227964859","Wed Jun 19 22:36:32 +0000 2024","6","KABINET MAKIN KACAU! JOKOWI BANTAH PEMERINTAH AKAN BAGI BANSOS BAGI PENJUDI ONLINE *yg tolol siapa???? https://t.co/cVeoQgM3QY","1803557505227964859","https://pbs.twimg.com/media/GQeF_j2aIAUy8dA.jpg","","in","","0","2","3","https://x.com/herculep638/status/1803557505227964859","1722014606712094720","herculep638"
"1804018876671537506","Fri Jun 21 05:09:51 +0000 2024","36","SISKA WIDI ANJING YA LUU. GA ADA OTAK DIKIRA KERJA SENDIRIAN GAMPANG APA TOLOL DASAR MEMEK KERIPUT LU IBU IBU TUA BANGSATT. GUA KENA OMEL ATASAN KAN ANJINGGGGG SISKA MEMEK MONYET. MEMEK LU BAU TERASI SISKA WIDI MONYETTTT https://t.co/T0u7i1werk","1804018876671537506","https://pbs.twimg.com/media/GQkpm0bakAIC5Gx.jpg","","in","Bogor, Jawa Barat","0","18","1","https://x.com/notyourbacteri/status/1804018876671537506","920305493301641216","notyourbacteri"
"1803790443924365518","Fri Jun 21 13:03:07 +0000 2024","5","@ketololan_tolol Fak kata gue teh https://t.co/2LFMV1F06s","1804137976324329829","https://pbs.twimg.com/media/GQmV7MyakAE9uB6.jpg","ketololan_tolol","in","","0","0","1","https://x.com/0yuda/status/1804137976324329829","59434040","0yuda"
"1803603493644894218","Thu Jun 20 11:42:27 +0000 2024","3","@kontolsuo Kalau suka ngomong tolol! https://t.co/fQuvH7myhG","1803755287331180845","https://pbs.twimg.com/media/GQg53-aa0AAd1L1.jpg","kontolsuo","in","","0","1","0","https://x.com/mashburneadead/status/1803755287331180845","1777679556868206592","mashburneadead"
"1804169587770188130","Fri Jun 21 15:08:44 +0000 2024","4","dih rekan kerja tolol orang diem disindir di sec ig . lawak bener","1804169587770188130","","","in","Kota Bogor, Jawa Barat","0","2","0","https://x.com/stvrvlightt__/status/1804169587770188130","1763923362789920768","stvrvlightt__"
"1776975283960324200","Sun Apr 07 14:08:16 +0000 2024","9006","Rencana CHINA memindahkan 200 juta warganya ke Indonesia itu NYATA Dan sudah terjadi 10 tahun ini dan akan makin masif 10 tahun ke depan. Kenapa bisa terjadi? Karena 58% orang Indonesia tolol berjiwa kacung dan imannya seharga Bansos! https://t.co/pNURBTGLZU","1776975283960324200","https://pbs.twimg.com/ext_tw_video_thumb/1776975243057487873/pu/img/X1Sj_KipNDKQFokS.jpg","","in","","173","1152","3610","https://x.com/DokterTifa/status/1776975283960324200","1502822366946402304","DokterTifa"
"1803413455514509753","Thu Jun 20 01:27:13 +0000 2024","13","@derymars @5teV3n_Pe9eL Kepala otak kau homeless Centang biru tolol https://t.co/szAuY5JSqJ","1803600457815957655","https://pbs.twimg.com/ext_tw_video_thumb/1803600415575179264/pu/img/6-TdhhYBkyZBOd-5.jpg","derymars","in","bumi","0","2","0","https://x.com/nighttbaroness/status/1803600457815957655","1546743224869351425","nighttbaroness"
"1721703209553826003","Tue Nov 07 01:36:47 +0000 2023","18101","Sedih si pelaku kriminal pelaku bikin anak ga tanggung jawab pelaku yg mandang cewe cuma objek. Dirayakan oleh org2 tolol","1721703209553826003","","","in","Bandung","440","790","5148","https://x.com/SanubariSamudra/status/1721703209553826003","1401922219626823682","SanubariSamudra"
"1803391864839827813","Wed Jun 19 12:14:07 +0000 2024","2","@kimjancokk @dinda876789 Manusia sok tau tentang ajaran agama cuihh pantes aja tolol https://t.co/JOZEJzqDp5","1803400869154886127","https://pbs.twimg.com/media/GQb3hsna8AAYEdh.jpg","kimjancokk","in","Indonesia","0","0","0","https://x.com/dnrz01/status/1803400869154886127","1882704313","dnrz01"
"1804261249456443580","Fri Jun 21 21:12:58 +0000 2024","189","JUDOL YANG HARUS LU BLOKIR TOLOL BUKAN TELEGRAM https://t.co/NUUYRFfubb","1804261249456443580","https://pbs.twimg.com/media/GQoGCogakAU334D.jpg","","in","","19","54","24","https://x.com/saytoalto/status/1804261249456443580","1622772220635525121","saytoalto"
"1804004144568766931","Fri Jun 21 04:11:19 +0000 2024","2","Tolol bat klo ada yang nyalain jm nya apalagi sampe boikot se album","1804004144568766931","","","in","❦FANACCଓ지민☾ Militarybro🎀•🇵🇸","0","0","0","https://x.com/FaceOnMe_/status/1804004144568766931","1444161722386817025","FaceOnMe_"
"1772807382600749459","Wed Mar 27 02:06:31 +0000 2024","6855","Bayar pajak mahal kualitas infra kayak kintil Bayar parkir dimana mana kualitas jalan kayak kandang babi Mau invest regulator bobrok bikin index aja gak becus Ini negara apa sih tolol","1772807382600749459","","","in","Always in your heart","170","259","2639","https://x.com/profesor_saham/status/1772807382600749459","1345898259445817345","profesor_saham"
"1803337162278183411","Wed Jun 19 15:47:03 +0000 2024","4","@tanyarlfes NAJIS BANGET MINTA KUOTA NONTON COLDPLAY JUGA AKHIRNYA KE ANAK 2000 an wkwkwkwkwkw Angel Tolol https://t.co/PUCX5EFsyE","1803454457105228140","https://pbs.twimg.com/ext_tw_video_thumb/1803454381142188034/pu/img/ihPRg3L3YcONi5Yu.jpg","tanyarlfes","in","","0","1","1","https://x.com/temankomunikasi/status/1803454457105228140","1621528796171227138","temankomunikasi"
"1744658533524836551","Tue Jan 09 09:53:03 +0000 2024","11062","Menyebut Anies dg GOBLOK &amp; TOLOL di belakang sangat tidak pantas.. Tuhan buka wajah aslinya!! https://t.co/9Bok1V0oQf","1744658533524836551","https://pbs.twimg.com/ext_tw_video_thumb/1744654198606811136/pu/img/2E1CytA1JcgAwiLB.jpg","","in","","357","729","3493","https://x.com/ekowboy2/status/1744658533524836551","1006827831995711488","ekowboy2"
"1803698665179193778","Thu Jun 20 07:57:27 +0000 2024","18","jiah kemarin ngata2in gua opini jelek sampe ngontol2in taunya :)) problematik. Sorry2 ya gua ga ada dari dulu nonton2in konten creator atau TC yg bahas build genshin dll :) gua belajar sendiri gua jg kalau bingung ada tmn gua yg ga toxic kek lu pd nih sirkel tolol @shiroyukinoo https://t.co/5bpYyRRicG","1803698665179193778","https://pbs.twimg.com/media/GQgFknfbwAAVqA6.png","","in","-","6","3","2","https://x.com/bor3doom/status/1803698665179193778","1133358465387094016","bor3doom"
"1804123152751960523","Fri Jun 21 12:04:13 +0000 2024","5","solo stan paling tolol menjijikkan kayak sampah si paling tersakiti padahal busuk kayak iblis. semoga renchin dapat karma jauh lebih sadis dan jahat dari apa yg kalian lakukan ke hc &amp; sfs.","1804123152751960523","","","in","HAEKARMA IS REAL","0","1","0","https://x.com/stresswueh/status/1804123152751960523","1666378304247730179","stresswueh"
"1803400600425779317","Wed Jun 19 12:13:03 +0000 2024","5","Imagine orang tolol yang awalnya bawa-bawa agama untuk mendiskriminasi orang lain tapi kemudian bawa negara lain untuk membenarkan opini bodohnya pdhl negara yang dimaksud pun melegalkan LGBT wkwk https://t.co/ubQzel41AH","1803400600425779317","https://pbs.twimg.com/media/GQb3R7QaIAAiTy-.jpg","","in","Indonesia","0","0","0","https://x.com/dnrz01/status/1803400600425779317","1882704313","dnrz01"
"1804117404924199000","Fri Jun 21 11:41:22 +0000 2024","3","My theory: bisa jadi ga paham diri sendiri mau dan butuhnya apa (ga dewasa) bisa jadi gabisa komunikasiin kebutuhannya ke pasangan (tolol) bisa jadi orangnya lack of empathy (brengsek) aja bisa jadi emang dasarnya gabisa monogami (manusia purba).","1804117404924199000","","","in","","0","0","0","https://x.com/_imnotyour__joy/status/1804117404924199000","395715704","_imnotyour__joy"
"1804234496189042745","Fri Jun 21 19:26:39 +0000 2024","2","Ini lucu sih tetanggaku liat story temanku yg share foto ini mungkin tetanggaku malas baca kitalg nongkrong trus dia bilang ini pak jokowi meninggal kata ogut ehh tolol itu baca itu ucapan selamat ulang tahun dan Menkominfo. Hahahah","1804234496189042745","","","in","","0","0","1","https://x.com/_rukunwarga/status/1804234496189042745","1649846708552204288","_rukunwarga"
"1803411241144295765","Wed Jun 19 12:55:20 +0000 2024","3","Definisi orang tolol https://t.co/a7dItPGS2u","1803411241144295765","https://pbs.twimg.com/media/GQcA8aoaIAE1WdV.jpg","","in","","0","4","1","https://x.com/rubihmsyh/status/1803411241144295765","1055493871235325952","rubihmsyh"
"1800697427852427383","Wed Jun 12 01:11:36 +0000 2024","5798","Abu Janda TOLOL‼️ Pendukung israel biadab macam kau yg sarap‼️ https://t.co/ZOwMD0jiE1","1800697427852427383","https://pbs.twimg.com/ext_tw_video_thumb/1800697324265779200/pu/img/ef-5YAWnvXustEaX.jpg","","in","","717","4543","1281","https://x.com/PelatihT1dur/status/1800697427852427383","1400896654820085760","PelatihT1dur"
"1803857843264852334","Thu Jun 20 18:29:58 +0000 2024","9","cewe gila mana yang dikatain lonte lacur perek jablay murahan tolol bukannya marah malah memeknya makin becek. dasar memek sangean. baru dikatain udah ngucur apalagi kalo mas genjotin pake kontol gede gu? makin ngompol pasti tuh memek ileran lu haha.","1803857843264852334","","","in","","0","2","4","https://x.com/udinberulah/status/1803857843264852334","1236775082090876928","udinberulah"
"1803864769176440938","Thu Jun 20 18:57:29 +0000 2024","8","Cape gw main sama noel cabol pembahasan tolol wkwkwk @ChieEstelle @ayumiookami noel https://t.co/rGrPYUaTeU","1803864769176440938","https://pbs.twimg.com/ext_tw_video_thumb/1803864341336461312/pu/img/eaubFjinwDIhATwG.jpg","","in","Astaroth Kingdom","2","0","1","https://x.com/AlexvonAstaroth/status/1803864769176440938","1593150110103638017","AlexvonAstaroth"
"1804079806725730575","Fri Jun 21 09:11:58 +0000 2024","2","ngekipop aja guys gsh jatuh cinta bkin kek org tolol ","1804079806725730575","","","in","was shinyuunpad","0","1","1","https://x.com/shinyujaksel/status/1804079806725730575","1675736187884158977","shinyujaksel"
"1804189467126960434","Fri Jun 21 16:27:43 +0000 2024","887","Aku cuma cewe arab tolol yg pngn dientot ","1804189467126960434","","","in","comedian & sangean ","4","174","19","https://x.com/ayafeeqoh/status/1804189467126960434","1731051168166739968","ayafeeqoh"
"1804120563256037656","Fri Jun 21 12:53:44 +0000 2024","24","@yaudehterserah Maaf kak tapi kamu beneran kontol (konyol dan tolol) https://t.co/MNn83Ewd7b","1804135615421940210","https://pbs.twimg.com/media/GQmTyBOb0AAw5sk.jpg","yaudehterserah","in","shiganshina","0","0","2","https://x.com/kopimatchadepan/status/1804135615421940210","2731990872","kopimatchadepan"
"1803642546901684629","Thu Jun 20 04:14:27 +0000 2024","5","jadi org ko tolol","1803642546901684629","","","in","","0","0","0","https://x.com/Beautybeyaa/status/1803642546901684629","1515494211432620035","Beautybeyaa"
"1804201293990547577","Fri Jun 21 17:14:43 +0000 2024","3","Jujur aja yah aku kalau gambar sering kok nyontoh punya orang tapi yah engga 100% sama ada bagian bagian yang aku ubah.Kalau dosen aku si bilang ATM (Amati tiru modifikasi) tapi ini anak tolol mala nyolong karya orang!!!!","1804201293990547577","","","in","Pematang Siantar, Indonesia","0","0","0","https://x.com/HoudiniDL3/status/1804201293990547577","1444340033981272065","HoudiniDL3"
"1804124068637298768","Fri Jun 21 12:07:51 +0000 2024","17","kasih tutor adekku yang tolol nyanyiin lagi dear god @Ratiihhhiihihi sebtulnya adekku ini dipungut di flay over sama bapak ibuku https://t.co/hiafMKygub","1804124068637298768","https://pbs.twimg.com/ext_tw_video_thumb/1804123969429344258/pu/img/GdXcFMXnHDkFvzV4.jpg","","in","Semarang, Jawa Tengah","0","19","2","https://x.com/baypablo777/status/1804124068637298768","1567765640714547204","baypablo777"
"1803796865256984801","Thu Jun 20 14:27:40 +0000 2024","38","ini tdi di tiktok pda bilang wy tolol bgt sih fans indo RAMBUTNYA AJA DH BEDA COK GK JELAS EMNG https://t.co/1Ib7qq24LQ","1803796865256984801","https://pbs.twimg.com/ext_tw_video_thumb/1803781146091913216/pu/img/ygkM2QG1NYMNNbgD.jpg","","in","naza's","0","1","1","https://x.com/wtrjim/status/1803796865256984801","1419379009058590723","wtrjim"
"1804080653413290435","Fri Jun 21 09:15:20 +0000 2024","26","statement rumor laknat yg kemaren mah bukan perlindungan tapi emang udah kewajiban agenshit tolol. bertahun tahun bias gw dikuntit ssg sampe dibobol rumahnya boro boro dapet perlindungan ditindak lanjut aja kagak anjing. seenaknya lo ngomong dilindungin dilindungin brengsek","1804080653413290435","","","in","","0","0","6","https://x.com/SOLEILE0S/status/1804080653413290435","1722167136532205568","SOLEILE0S"
"1804134273982886078","Fri Jun 21 12:48:24 +0000 2024","702","Baca komentar dan kutipannya ternyata masih banyak orang tolol yang membela doi cuma karena doi anti pemerintah. Padahal doi juga pernah berceramah untuk membunuh umat kristen yang ada diIndonesia bahkan doi dalang dibalik pembunuhan 3 jamaah ahmadiyah dibanten","1804134273982886078","","","in","","28","134","145","https://x.com/AbidZikril62016/status/1804134273982886078","1696033598653267968","AbidZikril62016"
"1803677480475304006","Thu Jun 20 06:33:16 +0000 2024","7","buat netizen tolol caper yang fitnah lucas cuma karna collab sm the onsu https://t.co/T8lIMPyukc","1803677480475304006","https://pbs.twimg.com/media/GQfzHDCbsAAWcCa.jpg","","in","she/her","0","0","1","https://x.com/kirbykhei/status/1803677480475304006","1291947156450865153","kirbykhei"
"1801507042370457765","Fri Jun 14 06:48:43 +0000 2024","8211","Siapa yg gak tau PT Krakatau Steel ?!! Perush Plat merah ini dulu sukses luar biasa mencetak keuntungan.. Sekarang kok bisa2 nya Tumbang.. Bangkrut krut krut!! Yezzz.. Akibat dari Kebijakan yg Salah yg dikeluarkan oleh Stupid Government ToLOL‼️ https://t.co/6cCyqhMifK","1801507042370457765","https://pbs.twimg.com/ext_tw_video_thumb/1801506933297557504/pu/img/ICnuRNZIw3yqF6pM.jpg","","in","Di hatimuuuu 🥰","249","395","2138","https://x.com/AraituLaki/status/1801507042370457765","1118723550649544704","AraituLaki"
"1804068191611818240","Fri Jun 21 08:25:49 +0000 2024","7","freak banget fans si rekan kerja satu ini. kalo mau protes ya protes ke agensi ajalah tolol ngapain bawa bawa rumor yg udah di konfirmasi ga bener. bego bgt lu kalo punya otak minimal dipake ya","1804068191611818240","","","in","","0","1","1","https://x.com/blossomiechan/status/1804068191611818240","1427347022","blossomiechan"
"1804238069991903444","Fri Jun 21 19:40:51 +0000 2024","5","Kenapa yang aing Klo ketemu sama cinta malah jadi tolol padahal akademik bagus anjing logika gua juga dapet nilai yang lumayan....","1804238069991903444","","","in","Bdg-Yk","0","1","0","https://x.com/ngarminef/status/1804238069991903444","1615875724690485249","ngarminef"
"1803285750630457396","Wed Jun 19 04:36:41 +0000 2024","22","Udah tolol sok keras pula siapa lagi kalo bukan dongok bau kambing https://t.co/BGXl5FEjvR","1803285750630457396","https://pbs.twimg.com/media/GQaO1IXaIAApML9.jpg","","in","solostan {ROLO}","0","0","1","https://x.com/junipaint/status/1803285750630457396","1667785342404145152","junipaint"
"1744632513740570766","Tue Jan 09 08:09:39 +0000 2024","6485","Prabowo Sindir Paslon 1 dengan kata-kata Goblok dan Tolol gara-gara bahas kepemilikan tanah Ini calon RI1 lho apa mau dipimpin orang yang akhlaknya seperti ini? https://t.co/mLAd8DXZvx","1744632513740570766","https://pbs.twimg.com/ext_tw_video_thumb/1744632454336630784/pu/img/f1EoV_uHLizyBOo4.jpg","","in","","340","386","2132","https://x.com/CakKhum/status/1744632513740570766","1112540525771386880","CakKhum"
"1803570666580705783","Thu Jun 20 06:22:38 +0000 2024","9","oke kali ini ini beneran resmi asal ga tolol kelupaan upload bukti https://t.co/CLXeteYb8d","1803674805427904563","https://pbs.twimg.com/media/GQfwrFVaIAE9hGQ.jpg","ImperialistsL","in","Jakarta, Indonesia","0","3","0","https://x.com/ImperialistsL/status/1803674805427904563","822448841735536640","ImperialistsL"
"1803461282663899158","Wed Jun 19 16:14:11 +0000 2024","21","si obedient wolf yg bakal kecap kecup kemudian ngerojokin si kakak sampe tolol https://t.co/rjNAehOHJg","1803461282663899158","https://pbs.twimg.com/media/GQcuemiaIAc1ERU.jpg","","in","INA, SE. Asia","0","1","3","https://x.com/lunnatttic/status/1803461282663899158","1397767449773101059","lunnatttic"
"1803768150053495255","Thu Jun 20 12:33:34 +0000 2024","30","Emang cowok lu tolol. Dah berlindung dibalik ceweknya kerja kelompok gak becus cuma jadi beban. Ha! Gak guna. Sebel banget Nih cewek juga bisa bisanya belain cowoknya sampe segitunya. Cowok lu salah coy. Gak bertanggung jawab. Najis. Semangat kak ngadepin wong gila","1803768150053495255","","","in","","0","0","3","https://x.com/fykhrk47/status/1803768150053495255","1457215930862239747","fykhrk47"
"1803265624661266462","Wed Jun 19 05:00:46 +0000 2024","18","@imnotkmj Iya gak cuman mys tapi mys paling busuk paling anjing tolol bgst jembut pepek https://t.co/hop8N9ZNaj","1803291814348333317","https://pbs.twimg.com/media/GQaUWUQaIAcnQHT.jpg","imnotkmj","in","","0","1","0","https://x.com/ELsserafimmies/status/1803291814348333317","1780171280341454848","ELsserafimmies"
"1802147554748215526","Sun Jun 16 01:13:53 +0000 2024","5678","Jangan menormalisasi Penjudi Online sebagai korban dengan cara diberi Bansos itu Sama Saja Memberi Insentif pada mereka DPR jangan ikut2an Tolol! https://t.co/V6jqTtMTyu","1802147554748215526","https://pbs.twimg.com/media/GQKDpRNbUAALU9-.jpg","","in","Indonesia","476","2142","1738","https://x.com/Heraloebss/status/1802147554748215526","1251824880967774208","Heraloebss"
"1803935057842929814","Thu Jun 20 23:36:47 +0000 2024","21","tolol bgt anjgg ada yg parkir di depan kos trus motornya dikasih beginian orang2 knp pada kaya setan https://t.co/5EZEESMcry","1803935057842929814","https://pbs.twimg.com/media/GQjdX90akAA3usW.jpg","","in","","1","65","1","https://x.com/Cream_SoupKfc/status/1803935057842929814","1150172423309783040","Cream_SoupKfc"
"1803304188656623959","Wed Jun 19 05:49:57 +0000 2024","5","orang tolol","1803304188656623959","","","in","🌙","0","0","0","https://x.com/gselleeri/status/1803304188656623959","1413399334347968512","gselleeri"
"1804096030511599848","Fri Jun 21 10:16:26 +0000 2024","4","Pasutri yg ngajak ffm kalo GAK MODAL MINTA NEGO PULA GAUSAH MIMPI MAU FFM SAMA GUE! Miskin hempas jauh2 Rate 2jtan aja panik lu minta nego. Emang dikira Gocar kondom pelumas STD Vaksin HPV gue bisa lo nego jg? MAKE UR MIND! Jangan TOLOL gue tinggal di Jakarta bukan suku padalaman","1804096030511599848","","","in","Jakarta Selatan, DKI Jakarta","0","2","0","https://x.com/lala_trista/status/1804096030511599848","1462948502435078144","lala_trista"
"1804227317289619611","Fri Jun 21 18:58:08 +0000 2024","3","baca trit nya spicles bgt knp ada org seclumsy ini anjir kek gw tolol tapi sorry bgt inimah keterlaluan anjir","1804227317289619611","","","in","rant — dnf","0","0","0","https://x.com/pacalmu/status/1804227317289619611","1370416981782843396","pacalmu"
"1803682384342368563","Thu Jun 20 13:54:11 +0000 2024","96","@awank2017 Ternyata anda tolol https://t.co/M7JKuxGmry","1803788437994213778","https://pbs.twimg.com/media/GQhYBjbaAAE-JKw.jpg","awank2017","in","bandung","4","21","9","https://x.com/thomaslorento/status/1803788437994213778","285556144","thomaslorento"
"1804052773450977358","Fri Jun 21 07:24:33 +0000 2024","4","BUKA MATA ELU YA AJG BUKA MATA ELU GAUSAH PURA PURA GTAU KEK ORG TOLOL BGITU KMNA AJA SLAMA INI?!?!? HMMM BABII?!?! KMANA AJA LU?!???!?! #JusticeForRenjun #JusticeForRenjun #JusticeForRenjun #JusticeForRenjun @SMTOWNGLOBAL https://t.co/d3I09pb4qX","1804052773450977358","https://pbs.twimg.com/media/GQlIbFVboAAGvU3.jpg","","in","ROLO coming soon💛💛","0","6","2","https://x.com/yeorin_yeon23/status/1804052773450977358","1511525864718024707","yeorin_yeon23"
"1804295239479574847","Fri Jun 21 23:28:01 +0000 2024","2","Ijin qrt!! Adek gw baru kena dan kaya org tolol gua bilangin jg cok ga sehat ini PT gila","1804295239479574847","","","in","Kota Surabaya, Jawa Timur","0","0","0","https://x.com/youraphroditee_/status/1804295239479574847","1263721534381674497","youraphroditee_"
"1803439137300815880","Wed Jun 19 14:46:11 +0000 2024","5","Anjayyy ada yang beli paper greetings di lunaetic pake kertas emas ini mah @bbysgaa tolol lu ah https://t.co/V6M0wMga27","1803439137300815880","https://pbs.twimg.com/media/GQcaVcva4AAMqqt.jpg","","in"," 𝒥𝓊𝓃𝑔𝓀𝑜𝑜𝓀 𝒢𝒾𝓇𝓁✿","5","11","2","https://x.com/jkvbriyns/status/1803439137300815880","1501067155315785728","jkvbriyns"
"1804048996304064809","Fri Jun 21 07:09:32 +0000 2024","3","agensi tolol. PRIVASI ARTIS LO YANG DIGANGGU KENAPA DIA RENUNGIN KESALAHAN BAJINGAN?? ADA GILAA NIH AGENSI BENER BENER JELEK LU https://t.co/03afNA9I5e","1804048996304064809","https://pbs.twimg.com/media/GQlE_yKakAIW77G.jpg","","in","dongren💋","0","5","2","https://x.com/huanglee00/status/1804048996304064809","1671683789658152960","huanglee00"
"1803399396031414762","Wed Jun 19 12:08:16 +0000 2024","6","Idih tolol kesiandeh negara yang lu maksud aja semuanya melegalkan LGBT hahahaha kesiandeh mampus disono lebih banyak yang mendukung daripada homophobia bungul kek lu Membenci orang koq ngajak-ngajak cuihhh gaje https://t.co/OiE2YtAU3A","1803399396031414762","https://pbs.twimg.com/media/GQb2L-kaYAEzhCG.jpg","","in","Indonesia","0","0","0","https://x.com/dnrz01/status/1803399396031414762","1882704313","dnrz01"
