"conversation_id_str","created_at","favorite_count","full_text","id_str","image_url","in_reply_to_screen_name","lang","location","quote_count","reply_count","retweet_count","tweet_url","user_id_str","username"
"1804162326490427572","Fri Jun 21 14:39:53 +0000 2024","3","Makin jelas knp bnyk calon kepala daerah tolol tp didukung Spy kepala daerahnya jg terlalu tolol utk melawan Secara berjenjang ketololan jg ditransfer smpai ke lapis terbawah org2 yg mengeluh hidup susah tp trus sumringah cm krn perkara dpt bansos","1804162326490427572","","","in","Di KIRI JALAN  X-Land","0","1","2","https://x.com/gmupd1993/status/1804162326490427572","1722208217684692992","gmupd1993"
"1780727505516896335","Wed Apr 17 22:38:16 +0000 2024","8509","3 KLUB TOLOL https://t.co/7fXl5rDEzw","1780727505516896335","https://pbs.twimg.com/media/GLZqOe0bQAA0TCy.jpg","","in","","268","475","1203","https://x.com/The_RedsIndo/status/1780727505516896335","1392892878314119170","The_RedsIndo"
"1776037763990839398","Fri Apr 05 00:02:54 +0000 2024","25777","Aarggg lemes banget 4 temen gua udah pada kena diabetes kronis pdhl umurnya masih 24-27. 3 di antaranya bukan genetik melainkan pola hidup. Pls gak usah ngajak gua makan snack2 kekinian dan minuman2 kek mixue atau matcha2 tolol itu.","1776037763990839398","","","in","","2227","845","6862","https://x.com/kafirmasi/status/1776037763990839398","448931499","kafirmasi"
"1757398340680208390","Tue Feb 13 13:36:29 +0000 2024","68403","ga sabar si ndud menang dilantik trus ngasih kebijakan tai biar kita bisa ngatain gara gara elu ni tolol ke temen yg nyoblos belio","1757398340680208390","","","in","","4041","1486","20144","https://x.com/bijitalisasi/status/1757398340680208390","1595323746008461313","bijitalisasi"
"1804093491791958026","Fri Jun 21 10:06:21 +0000 2024","2","maaf klau ini harshword. KAMBING. FUCK. AGENSI MONYET. EMANG SI ICA INI AGENSI PALING TOLOL SETOLOL NYA. beneran nih emosi udh di ubun kepala asli dah. kesel sumpah. PROTECT ARTIS LU ANJIRRRRRRR @SMTOWNGLOBAL","1804093491791958026","","","in","재민이 마음속에","0","0","0","https://x.com/arsnquila_/status/1804093491791958026","1445066080083320835","arsnquila_"
"1804144768643183092","Fri Jun 21 13:30:06 +0000 2024","15","makanya aku sering memaki Wahabi dengan sebutan tolol. udah tepat. meskipun sebenernya makian itu tidak sebanding dengan perilaku takfir dan tabdi' mereka.","1804144768643183092","","","in","Sumenep, Indonesia 🇮🇩","0","0","4","https://x.com/mad_rojak/status/1804144768643183092","354240481","mad_rojak"
"1804098695824314661","Fri Jun 21 10:27:02 +0000 2024","9","eh gini ya SM TOLOL. gue ajarin. harusnya lo bilang SM Entertaiment juga meminta maaf karena gagal melindungi artis kami atas penyebaran privasi oleh sasaeng bukan malah SME juga meminta maaf karena gagal menjaga artis kami dan sifatnya like wtf itu anak lo diserang","1804098695824314661","","","in","","0","2","2","https://x.com/jhsvals/status/1804098695824314661","1314408668167692289","jhsvals"
"1804124718645326286","Fri Jun 21 12:10:26 +0000 2024","11","Gw capek banget sama kelakuan tolol orang-orang ini. You did nothing for Renjun if you keep hating other members.","1804124718645326286","","","in","","0","0","11","https://x.com/dongbeidage2303/status/1804124718645326286","1653639511480619011","dongbeidage2303"
"1804123387494596635","Fri Jun 21 12:05:09 +0000 2024","7","duh lo kalo ngmg gini jg samanya aja lo tolol! lo doain yg buruk buat memb lain lo jg nge tololin ttg rj yg bhkn blm jg ada kepastiannya. @smtownbangkrut lo cm mau bagian marah2 gjlsnya atau gmn sih? gausa mancing2 war lah udh cukup kita lwn ssg skrg mlh lo ikut2an getwt gini https://t.co/y5q8YNZlfC","1804123387494596635","https://pbs.twimg.com/media/GQmIp24akAIQw15.jpg","","in","","0","0","0","https://x.com/kareenjun/status/1804123387494596635","1664494167039565824","kareenjun"
"1804082539495350316","Fri Jun 21 09:22:50 +0000 2024","4","Bacot (Bani Comberan Tolol) sebagai pendukung Bago (Bani Gorong2)","1804082539495350316","","","in","Di hatimu","0","0","3","https://x.com/jakardoding/status/1804082539495350316","1784988372790075395","jakardoding"
"1803834025313796492","Thu Jun 20 23:50:36 +0000 2024","3","@zy_zy_lestary @Yattie2023 @dika_maxelyou @mas_veel @adri_7i @Rocky_Antonie @Subhan_oke02 Ko pakeAPBN klo investor membeludak? Yg sumbu pendek itu loe tolol..... https://t.co/yzaouFH2pF","1803938534883234110","https://pbs.twimg.com/media/GQjgiTtakAITn_C.jpg","zy_zy_lestary","in","Jakarta Capital Region","0","2","0","https://x.com/azul_zulia44436/status/1803938534883234110","1793943954725249025","azul_zulia44436"
"1804111290497142877","Fri Jun 21 11:17:05 +0000 2024","122","tolol gue sebelum ditarik sama admin MALAH PAKE PARFUM DULU KEK BUAT APA ANJG.. REFLEK.. https://t.co/77eKaCNqJS","1804111290497142877","https://pbs.twimg.com/media/GQl9qIIaIAAH_6H.jpg","","in","aespa jkt48","2","15","0","https://x.com/beutedegre/status/1804111290497142877","1587183333548560384","beutedegre"
"1803783254975336464","Thu Jun 20 13:33:35 +0000 2024","2","tolol tukang tipu biarin aja pantant lu kelap kelip hari lu senin terus @cottovcandy https://t.co/QDs9P0TI9y","1803783254975336464","https://pbs.twimg.com/media/GQhTTmCa4AI4auO.jpg","","in","","0","1","1","https://x.com/ruriezkyu/status/1803783254975336464","1153511690039779328","ruriezkyu"
"1804166707231281534","Fri Jun 21 16:42:47 +0000 2024","5","@kumparan Tutup situsnya &amp; Tangkap bandarnya tolol https://t.co/GFmIkwo6Ov","1804193258911993919","https://pbs.twimg.com/media/GQnINGfboAAFuYd.jpg","kumparan","in","Indonesia","1","0","1","https://x.com/RK_Lamongan/status/1804193258911993919","736600582538944512","RK_Lamongan"
"1803789613519298594","Thu Jun 20 13:58:51 +0000 2024","2","gem tolol tp raze sagenya lebih https://t.co/iFeYstd5VI","1803789613519298594","https://pbs.twimg.com/media/GQhZEOSbQAAhDv2.jpg","","in","suguru","0","2","0","https://x.com/marylionette/status/1803789613519298594","1512640994944364545","marylionette"
"1803297245766594562","Wed Jun 19 05:22:21 +0000 2024","14","yang nyenggol duluan siapa tolol https://t.co/ULp72GtzVN","1803297245766594562","https://pbs.twimg.com/media/GQaZSQbaIAYE60n.jpg","","in","","8","3","7","https://x.com/otksong/status/1803297245766594562","1673038266311000064","otksong"
"1804166778236604746","Fri Jun 21 14:57:34 +0000 2024","5","goblok tiap hari ada aja orang tolol tingkahnya aneh bisa ga si dunia berjalan normallll yang isinya orang waras semuaaaaaa anjir marah bgt","1804166778236604746","","","in","Jawa Timur, Indonesia","0","0","0","https://x.com/naladelreyyyyy/status/1804166778236604746","1199522197066276869","naladelreyyyyy"
"1804139488333160915","Fri Jun 21 13:09:07 +0000 2024","11","Yg tolol itu yg milih Jokowi 2 periode dan yg nyoblos anaknya.... Untuk membuat bangkrut industri tekstil itu butuh waktu yg tidak sebentar! Nikmati saja pilihan kalian sekarang! Ok gas! ","1804139488333160915","","","in","","0","0","3","https://x.com/vanc1Bozz/status/1804139488333160915","1622484956151975937","vanc1Bozz"
"1803048094344548571","Fri Jun 21 22:59:34 +0000 2024","2","@Muslim_AntiPKI9 Tukang dugem tukang mabok tukang maen perempuan malah dikasih gelar Gus. Yg ngasi TOLOL nya bener2 natural","1804288077097242772","","Muslim_AntiPKI9","in","","0","0","1","https://x.com/MuhammadFachroz/status/1804288077097242772","1688164697206579200","MuhammadFachroz"
"1804117663658205672","Fri Jun 21 11:42:24 +0000 2024","7","kalo ada award orang terbulol alias BUCIN TOLOL guren lah si juara satunya","1804117663658205672","","","in","20↑ • ","0","0","0","https://x.com/elqric/status/1804117663658205672","1120255900705415168","elqric"
"1804128639912677632","Fri Jun 21 12:26:01 +0000 2024","3","ada lagi komentar di t*ktod yang bikin kesel waktu ngomentarin snc : sumpah seth ganteng bgt sayang ukenya item kek anjrit tolol uke secantik bahenol nan mempesona macem umi theo dirasisin Fakk!","1804128639912677632","","","in","Indonesia","0","3","0","https://x.com/taejulilgirl/status/1804128639912677632","1598276042061361153","taejulilgirl"
"1803299793483301182","Wed Jun 19 09:57:37 +0000 2024","6","@Heraloebss Ambisinya orang tolol emang gitu https://t.co/wiwEClOGh9","1803366519931383930","https://pbs.twimg.com/media/GQbYSreaIAAmxom.jpg","Heraloebss","in","INDONESIA","1","0","3","https://x.com/Candj09/status/1803366519931383930","1336091630","Candj09"
"1803433498214096913","Wed Jun 19 14:23:46 +0000 2024","3","yg komen itu tolol bgt","1803433498214096913","","","in","`♡´-🐻‍❄️✩°｡🥛","0","0","0","https://x.com/matchaeryou/status/1803433498214096913","1523334929803018241","matchaeryou"
"1803299793483301182","Wed Jun 19 05:32:29 +0000 2024","209","Pantesan ada DPR tolol yang setuju Korban Judi Online di beri Bansos ternyata MKD nya Juga Tolol!! FYI : Sebelumnya ada anggota DPR yang dilaporkan keluarganya karena diduga bermain judi online Namun MKD hanya memberi teguran saja Sementara Dalam Kode Etik Anggota DPR https://t.co/MDBohzU4Fn","1803299793483301182","https://pbs.twimg.com/media/GQabmU-bAAAp1P1.jpg","","in","Indonesia","7","37","76","https://x.com/Heraloebss/status/1803299793483301182","1251824880967774208","Heraloebss"
"1803703783761015112","Thu Jun 20 08:17:47 +0000 2024","2","Cuma orang tolol yang sekarang ngga anti Jokowi.","1803703783761015112","","","in","","0","0","2","https://x.com/Engfaroo/status/1803703783761015112","107083000","Engfaroo"
"1803668056331460864","Thu Jun 20 07:15:56 +0000 2024","37","@Tita83079013 Daging babi itu mengandung belatung dan babi suka makan taik nya sendiri bahaya kalo dikonsumsi bikin otak jadi makin tolol !!! Negara² yg cerdas pasti sehari-hari nya gak makan babi konon kencing onta campur korma akan membuat si otong sehat kuat dan tahan lama https://t.co/hyX2zjG3qc","1803688216119374318","https://pbs.twimg.com/media/GQf837daIAEAsys.jpg","Tita83079013","in","DKI Jakarta, Indonesia","3","10","2","https://x.com/mengudarabebas/status/1803688216119374318","1745099762192547840","mengudarabebas"
"1803760988652728568","Fri Jun 21 04:31:56 +0000 2024","28","@timothylp @mengudarabebas @_NeverAlonely Udah jelas jelas salah anjingnya gini masih dibela. Jadi dog lover boleh tolol jangan. Apa perlu ditarik garis VAR? Otak ama nurani dipake. Itu korban diutamain jangan malah mencoba bela dan cari pembenaran. https://t.co/iRSviggWro","1804009330989257201","https://pbs.twimg.com/media/GQkg7DJakAICAh-.jpg","timothylp","in","Los Angeles, CA","0","2","2","https://x.com/fahrenji/status/1804009330989257201","72201450","fahrenji"
"1803917006279971322","Thu Jun 20 22:25:04 +0000 2024","1","sini bacolin cewe gua tocil hina2 in ampe tolol. dm #bacol #bacolin #crot #pejuhin #lecehin","1803917006279971322","","","in","","0","2","0","https://x.com/sexxxysixxx1/status/1803917006279971322","1521813762982178816","sexxxysixxx1"
"1803354844864106753","Wed Jun 19 09:11:14 +0000 2024","17","Muka kayak begini yg diumpetin wekwan tolol https://t.co/cTupZxtqbw","1803354844864106753","https://pbs.twimg.com/media/GQbNq0jaIAEednD.jpg","","in","Zerosegarden","0","2","3","https://x.com/illovellicky/status/1803354844864106753","1750057020651343872","illovellicky"
"1803723091853607187","Thu Jun 20 09:34:31 +0000 2024","14","si kakek bau tanah ini bukan nya ngurusin kjmu malah ngurusin pbb dasar pj tolol","1803723091853607187","","","in","","0","0","2","https://x.com/leavemeffs/status/1803723091853607187","1526510356197421056","leavemeffs"
"1804102985292849557","Fri Jun 21 10:44:04 +0000 2024","4","makanya jgn kepo tolol gausa cari tau hal yg emg ga seharusnya lu tau kebiasaan bgt org bernama pika ini ","1804102985292849557","","","in","","0","0","0","https://x.com/carollineeey/status/1804102985292849557","1283778422339076096","carollineeey"
"1803616915199500791","Thu Jun 20 02:32:36 +0000 2024","2","cuma cowo tolol yang mau jadi sub ","1803616915199500791","","","in","Made In Heaven","0","6","0","https://x.com/dystinctxyz/status/1803616915199500791","1346540605","dystinctxyz"
"1804180437868462295","Fri Jun 21 15:51:51 +0000 2024","4","Indonesia gakan pernah maju selama pejabat publik masih boomer tolol yg cuma mikirin untung sendiri gak mikir masalah gini tuh bikin susah banyak orang Toh mereka bisa keluar masuk negara lewat jalur belakang","1804180437868462295","","","in","Bandung, Indonesia","0","0","1","https://x.com/fdasmansyah/status/1804180437868462295","330325445","fdasmansyah"
"1804103935965434016","Fri Jun 21 10:47:51 +0000 2024","30","kaum lu (renchin) juga tolol nih https://t.co/A1h78qdSZk","1804103935965434016","https://pbs.twimg.com/media/GQl21ygb0AAcr7J.jpg","","in","","0","1","13","https://x.com/66hyucks/status/1804103935965434016","1720323346263654400","66hyucks"
"1803425808805220842","Wed Jun 19 13:53:13 +0000 2024","2","botfrag gapapa asal jangan tolol matinya anjingg","1803425808805220842","","","in","Kota Surabaya, Jawa Timur","0","0","0","https://x.com/_Shintaptrn/status/1803425808805220842","1241621962377461762","_Shintaptrn"
"1803685778557735225","Thu Jun 20 07:06:15 +0000 2024","16","Ngerasain memek kedutan padahal cuman ngebayangin adegan sex tolol banget duh","1803685778557735225","","","in","","0","7","1","https://x.com/NPerson24pril/status/1803685778557735225","1653376559036928001","NPerson24pril"
"1804073342434979960","Fri Jun 21 08:46:17 +0000 2024","11","Lu tau tolol ga? lama lama devnya gw plintir bijinye juga ni batangnye gw potek kek es kiko","1804073342434979960","","","in","streamer building, worlds edge","0","5","1","https://x.com/FrizTea_/status/1804073342434979960","1282018200520015872","FrizTea_"
"1804144485196271956","Fri Jun 21 13:28:59 +0000 2024","2","Aturan tolol mana sih tiket masuk diganti liatin stnk kan ribet ya ajg puki cuki","1804144485196271956","","","in","heart","0","0","0","https://x.com/HafizhParingga/status/1804144485196271956","1140997262920712194","HafizhParingga"
"1804066286013464795","Fri Jun 21 15:16:36 +0000 2024","3","@geloraco Manusia ini BACOT (Bani Comberan Tolol) yg menjilpan bosnya yg Bago (Bani Gorong2)","1804171570589634814","","geloraco","in","Di hatimu","0","0","0","https://x.com/jakardoding/status/1804171570589634814","1784988372790075395","jakardoding"
"1803762905856590273","Thu Jun 20 12:12:43 +0000 2024","33","iya lagi https://t.co/cIgwWjAaJd","1803762905856590273","https://pbs.twimg.com/media/GQhAza6bcAA1mqG.jpg","","in","","0","2","6","https://x.com/ketololan_tolol/status/1803762905856590273","1286878661493190657","ketololan_tolol"
"1803646376850694651","Thu Jun 20 04:29:41 +0000 2024","2","generasi lu aja yang tolol di kibulin kerja 20 jam","1803646376850694651","","","in","","0","0","0","https://x.com/holymolyteodt/status/1803646376850694651","1677740056860319744","holymolyteodt"
"1804286312004096215","Fri Jun 21 22:52:33 +0000 2024","18","BTS bisa milih dan nolak tawaran yang di kasih? Narasi goblok dan tolol(maaf agak kasar) yang masih di pegang teguh sama orang2 dalam fandom.","1804286312004096215","","","in","","0","4","3","https://x.com/Mustlove2seok/status/1804286312004096215","1610390995077828608","Mustlove2seok"
"1804036324191801844","Fri Jun 21 06:19:11 +0000 2024","2","Sm tolol bodoh ya Tuhan Mau smpe kapan?","1804036324191801844","","","in","","0","0","0","https://x.com/urlovendun_/status/1804036324191801844","1580705770722557952","urlovendun_"
"1804043980663066779","Fri Jun 21 06:49:37 +0000 2024","2","tolol bat dr kemaren kaga di sent anjg https://t.co/rKrPCZAadV","1804043980663066779","https://pbs.twimg.com/media/GQlAb2obYAE9Owj.jpg","","in","Indonesia","0","3","0","https://x.com/azkaathallahh/status/1804043980663066779","1146755562748514307","azkaathallahh"
"1804043840938238295","Fri Jun 21 06:49:03 +0000 2024","10","‼️ HELP RT PENIPU SCAMMER RENTAL MOBIL ‼️ Nama : Husni Mubaraq Rek : 083901044878533 BRI No. Wa : 085656162644 Instagram : sewamobilrental_jakarta JANGAN SAMPAI PADA KETIPU SAMA FOLLOWERS BANYAK YAAA TEMEN GUE EMANG TOLOL BISA-BISA NYA KETIPU 3 5JUTA https://t.co/me4QXpzxr9","1804043840938238295","https://pbs.twimg.com/media/GQlATfbakAARTCb.jpg","","in","","0","0","20","https://x.com/junkyumaboy/status/1804043840938238295","1297525829950267393","junkyumaboy"
"1804025022610014472","Fri Jun 21 05:34:17 +0000 2024","2","Tolol hidup nyusahin mati nyusahin. Bukannya ninggalin warisan malah ninggalin hutang.","1804025022610014472","","","in","","0","0","0","https://x.com/momwholifts/status/1804025022610014472","1540096198870454272","momwholifts"
"1740201226749583510","Thu Dec 28 02:41:18 +0000 2023","11179","Mahasiswa tolol!","1740201226749583510","","","in","Jakarta Capital Region, Indonesia","74","688","2567","https://x.com/abdurarsyad/status/1740201226749583510","216649091","abdurarsyad"
"1790748642552451436","Wed May 15 14:18:41 +0000 2024","6972","Kok bisa bisanya orang problematik kayak gini diundang ke podcast terus tolol-tololin orang yang boikot. Samuel Christ lain kali yang bener kalo undang orang ke podcast!! https://t.co/SduFzUI0Ao","1790748642552451436","https://pbs.twimg.com/media/GNoEZJCb0AAQ8Jg.jpg","","in","Jakarta, Indonesia","243","766","1894","https://x.com/erlanishere/status/1790748642552451436","69561307","erlanishere"
"1787474575338663971","Mon May 06 13:28:43 +0000 2024","6927","Habib ini bilang siapa yg mau memberi dana besar kepada dia maka ia akan masuk surga. Karena ia cucu Nabi maka uangnya bukan utk dia tapi utk Nabi Muhammad yg sdh wafat ratusan tahun yg lalu Satu2 pribumi tolol pun maju sumbangkan dana demi masuk surga. https://t.co/pur7rgVg2f","1787474575338663971","https://pbs.twimg.com/ext_tw_video_thumb/1787474516140294144/pu/img/4KkO8HruJiLdPoNY.jpg","","in","","1371","1769","1753","https://x.com/SammiSoh/status/1787474575338663971","795498951336075264","SammiSoh"
"1749086989390160213","Sun Jan 21 15:10:09 +0000 2024","32831","Gak nonton debat tapi menyimpulkan dr timeline keknya gibran tolol ya","1749086989390160213","","","in","","675","596","4691","https://x.com/syarafmaulini/status/1749086989390160213","135888050","syarafmaulini"
"1778662020356911333","Fri Apr 12 05:50:46 +0000 2024","10769","TW// pelecehan seksual syaiful jamil Sebenarnya bukan pencabulan penghisapan Dan diketawain bareng-bareng najis sirkel enabler dan fans tolol https://t.co/pU7NJy4bIC","1778662020356911333","https://pbs.twimg.com/amplify_video_thumb/1778661882054025216/img/-k8FOMaC6mtzlRBl.jpg","","in","","1334","858","3014","https://x.com/cinnamongirlc/status/1778662020356911333","58184629","cinnamongirlc"
"1803850711316467844","Thu Jun 20 18:01:38 +0000 2024","2","adam wharton kobbie mainoo cole palmer anthony gordon. bench sebagus ini yang dimasukkin malah galer southgate tolol bgt asli","1803850711316467844","","","in","","0","0","0","https://x.com/malikfalahn/status/1803850711316467844","577091650","malikfalahn"
"1804141772047855845","Fri Jun 21 13:18:12 +0000 2024","3","BGSTT!!! MIMPI APA GW MASUK GRUB ISINYA KUMPULAN IBLIS DAN BARU SADAR SETELAH SEMUA HABIS. TOLOL EMANG GW","1804141772047855845","","","in","","1","1","2","https://x.com/cherryv_taetae/status/1804141772047855845","4649630479","cherryv_taetae"
"1803621204475224220","Thu Jun 20 02:49:39 +0000 2024","24","AKHIRNYA KELAR UASSSS YEEEEEEEEEEEEEEE Tadi soalnya ada nyuruh translate text dan seharusnya bawa kamus tapi aku kikir jadi ga beli dan aku translate ga pake kamus dan kaya orang tolol tapi kelar juga karena cara kerja otakku aneh Masa ingat kata karena ber dialog https://t.co/r5tcpZqjXN","1803621204475224220","https://pbs.twimg.com/media/GQe_7SnaIAIly9K.jpg","","in","","0","7","1","https://x.com/ACampbell_VT/status/1803621204475224220","1656512995223310338","ACampbell_VT"
