"conversation_id_str","created_at","favorite_count","full_text","id_str","image_url","in_reply_to_screen_name","lang","location","quote_count","reply_count","retweet_count","tweet_url","user_id_str","username"
"1748028724703068217","Thu Jan 18 17:04:59 +0000 2024","23627"," Terima kasih pak Prabowo pake pose jari Itu uang negara untuk bantuan ke Palestina jangan dipersonalisasi seakan-akan itu bantuan pribadi apalagi pake unsur unsur kampanye bener bener artis tolol https://t.co/U7YWvSL9k7","1748028724703068217","https://pbs.twimg.com/amplify_video_thumb/1748028593048031232/img/s0cpGLhDAH-o4i43.jpg","","in","","1828","916","5460","https://x.com/cinnamongirlc/status/1748028724703068217","58184629","cinnamongirlc"
"1759440842337693852","Mon Feb 19 04:52:40 +0000 2024","9202","Ga cantik sih tapi soal effort ke cowo boleh di adu sampe tolol","1759440842337693852","","","in","","424","288","3532","https://x.com/JIHANNN____/status/1759440842337693852","1219275671819567106","JIHANNN____"
"1731981212435017847","Tue Dec 05 10:17:54 +0000 2023","21396","ternyata cuman penyakit. tolol https://t.co/atbTGHnfER","1731981212435017847","https://pbs.twimg.com/media/GAk7u7OaYAAlRbG.jpg","","in","near u","1257","576","4586","https://x.com/bbyyygum/status/1731981212435017847","1250230920365277184","bbyyygum"
"1800407740386628007","Tue Jun 11 06:00:29 +0000 2024","26542","tuhan ciptain marah buat ngelawan lo malah milih ngalah mulu kek orang tolol","1800407740386628007","","","in","akun ni dikelola 2 kepribadian","1156","602","8589","https://x.com/flnive_/status/1800407740386628007","1394281787036078081","flnive_"
"1719582305067659623","Wed Nov 01 05:09:04 +0000 2023","28930","pdahal tinggal ngetik boncengan https://t.co/iLDWJSZUQK","1719582305067659623","https://pbs.twimg.com/media/F90u-mraoAAeSNI.jpg","","in","","680","500","5413","https://x.com/ketololan_tolol/status/1719582305067659623","1286878661493190657","ketololan_tolol"
"1803407064074498240","Wed Jun 19 12:38:44 +0000 2024","855","kelamaan ditinggal jadi lupa ya kalo kamu budaknya daddy? lonte tolol nya daddy? memek lacur mu harus selalu siap buat daddy lecehin. mau daddy ludahin tepok tepok genjot kamu harus nurut","1803407064074498240","","","in","Bekasi, Jawa Barat","0","1","33","https://x.com/yourpspartner/status/1803407064074498240","1214574932488679424","yourpspartner"
"1727962580080308340","Fri Nov 24 08:09:17 +0000 2023","7501","Bucin tolol gatau aturan","1727962580080308340","","","in","","106","272","1052","https://x.com/iquaysss/status/1727962580080308340","1564448799593861121","iquaysss"
"1776418918435045718","Sat Apr 06 01:17:29 +0000 2024","11209","Budaya toLoL from Indramayu https://t.co/7PsQgr7bjI","1776418918435045718","https://pbs.twimg.com/ext_tw_video_thumb/1776418824642072576/pu/img/iKKSd15d-_lpJdZD.jpg","","in","New York, USA","1515","2315","2444","https://x.com/hahingang_/status/1776418918435045718","1765382351989997568","hahingang_"
"1723707048112861432","Sun Nov 12 14:19:19 +0000 2023","10236","opah tantrum https://t.co/8nUNc3Vamz","1723707048112861432","https://pbs.twimg.com/ext_tw_video_thumb/1723707000746549248/pu/img/8Sku4m8_MTE-qeQv.jpg","","in","","378","336","2760","https://x.com/ketololan_tolol/status/1723707048112861432","1286878661493190657","ketololan_tolol"
"1765597847997804646","Thu Mar 07 04:38:24 +0000 2024","9987","ayi stop menjadi tolol mission failed. bukan berarti karena dia ga speakup dia oke2 aja buat dilecehin anjing ayi tolol. https://t.co/F5JQTltxlu","1765597847997804646","https://pbs.twimg.com/media/GICp4ocagAAfknq.jpg","","in","CLOSE.","759","266","1046","https://x.com/inmghao/status/1765597847997804646","1435173177965957125","inmghao"
"1757993765502148806","Thu Feb 15 05:02:30 +0000 2024","38914","yg w gak terima tuh kita harus nurutin suara terbanyak dari pengguna tiktok can you imagine kita disetir orang tolol ","1757993765502148806","","","in","","1135","1242","7878","https://x.com/xxxburuhcucixxx/status/1757993765502148806","1683166607286349824","xxxburuhcucixxx"
"1803316396438462487","Wed Jun 19 06:38:27 +0000 2024","3","Nitip harga MANGOSTAR VSAT sebelum nanti dirubah TELKOMSAT WKWKWKWKWKKWK TOLOL https://t.co/0UHt59FFjZ","1803316396438462487","https://pbs.twimg.com/media/GQaqs9daIAMUa-K.jpg","","in","","0","1","0","https://x.com/abdelrz20/status/1803316396438462487","2658638329","abdelrz20"
"1753017515079573793","Thu Feb 01 11:28:39 +0000 2024","8305","ga semua orang dapetin gua versi ngemis kaya orang tolol","1753017515079573793","","","in","","222","298","2640","https://x.com/traptizedd/status/1753017515079573793","1542802092532051968","traptizedd"
"1734152293782835230","Mon Dec 11 10:05:00 +0000 2023","8487","ptn! BELAJAR TOLOL . . .","1734152293782835230","","","in","RULES 👉","1068","814","2942","https://x.com/sbmptnfess/status/1734152293782835230","1205629250423779328","sbmptnfess"
"1803441640415379803","Wed Jun 19 14:56:08 +0000 2024","864","yiheon x sekyung ft. insoo ㅡoneshot au √ cemburu tanda cinta x √ cemburu tanda tolol https://t.co/m3DRvD31XO","1803441640415379803","https://pbs.twimg.com/media/GQccDDEakAAWExS.jpg","","in","space💫","7","1","104","https://x.com/newyeomu/status/1803441640415379803","1486973741183938562","newyeomu"
"1740105437427712409","Wed Dec 27 20:20:40 +0000 2023","16244","Siapapun yg mobilisasi kebencian pada Rohingya selamat kalian menang melawan pengungsi lemah korban genosida. Rayakan kemenangan kalian ama mahasiswa tolol ini Keren! Kalian hampir sukses mengulang tragedi kekerasan etnic yg berulang menghantui bangsa ini akibat misinformasi https://t.co/jHS1xhN2vV","1740105437427712409","https://pbs.twimg.com/ext_tw_video_thumb/1740083687855919104/pu/img/gHugpocAfvwSKhlF.jpg","","in","Yogyakarta - Palembang","1075","1089","6220","https://x.com/rgantas/status/1740105437427712409","1492990375","rgantas"
"1804070180966048242","Fri Jun 21 08:33:43 +0000 2024","7","fans tolol mana yg bisa bisanya ngetik begini ke biasnya sendiri cuma demi perlindungan dari agenshit????? kata gw tobat mbak lo udah sakit parah itu anjing. miris rj punya fans setan kayak lo. inget kata wali @sungrenn https://t.co/lzyqfs2WMm","1804070180966048242","https://pbs.twimg.com/media/GQlYRNxakAUTzaZ.jpg","","in","","0","0","0","https://x.com/SOLEILE0S/status/1804070180966048242","1722167136532205568","SOLEILE0S"
"1804182375062262256","Fri Jun 21 15:59:32 +0000 2024","4","Gw berasa ngelihat opini orang-orang tolol yang gak percaya COVID 2020 lalu.","1804182375062262256","","","in","He/They. NSFW.","0","0","0","https://x.com/Wherewithalsm/status/1804182375062262256","434824210","Wherewithalsm"
"1757220452244844598","Tue Feb 13 01:49:38 +0000 2024","33575","Kita tuh nggak bodoh. Nggak ada demo mahasiswa banner diprint kecuali emang masa bayaran. Nggak ada demo isinya endors pemerintah. Tolol tolol. Mau nyaingin Gejayan memanggil? Mimpi lo kon","1757220452244844598","","","in","","391","459","8232","https://x.com/jahterra/status/1757220452244844598","1294438367166263297","jahterra"
"1804082050452066780","Fri Jun 21 09:20:53 +0000 2024","5","ya frustasi mah frustasi aja gobloooook ngapain lo pake segala bawa bawa rumor having sex????? dikata fans yg biasnya juga sama sama dikuntit ssg kagak frustasi apa ya tolol tolol. kita semua yg tau seberapa tainya ssg juga frustasi kagak lo doang idiot","1804082050452066780","","","in","","0","0","1","https://x.com/SOLEILE0S/status/1804082050452066780","1722167136532205568","SOLEILE0S"
"1786403869913989130","Fri Jun 21 22:33:20 +0000 2024","4","@riizeva7 Tidak akan ku biarkan postan ini hilang udh ngatain SALAH LAGI TOLOL. Moa juga mengakui agensi kita jelek lu ga ush ngebela agensi deh pdhl aslinya jengkel juga sm agensi lo. Si paling bela agensi wkwk ternyata fansnya juga penyepong agensi https://t.co/M20VPzwUJi","1804281478165205502","https://pbs.twimg.com/media/GQoYcV8akAAsfKL.jpg","riizeva7","in","","0","1","0","https://x.com/Kiiipooo1/status/1804281478165205502","1297902709111025665","Kiiipooo1"
"1731844793146171444","Tue Dec 05 01:15:49 +0000 2023","8055","Ini bukan soal salah bicara yg selesai cukup dgn minta maaf. Menyebut Asam Folat dengan Asam Sulfat apalagi sampai dua kali Ini Tolol yang fatal. Harusnya kamu malu tidak punya kapasitas berani-beraninya jadi Cawapres. https://t.co/yB9W1UB7jc","1731844793146171444","https://pbs.twimg.com/media/GAi_qGUb0AA90cw.jpg","","in","","217","2157","2472","https://x.com/DokterTifa/status/1731844793146171444","1502822366946402304","DokterTifa"
"1761588847350251552","Sun Feb 25 03:08:04 +0000 2024","9893","tolol kalau lu menormalisasi balikan sehabis diselingkuhin","1761588847350251552","","","in","","660","659","2665","https://x.com/blos00m/status/1761588847350251552","1668094329284628481","blos00m"
"1753058841921540489","Thu Feb 01 14:12:52 +0000 2024","36985","siang tadi kk ak call mama nangis krn ada muridnya yg ngatain kk ak tolol kronologinya si murid ini di suruh setor hafalan ke kantor krn dia doang yg blm setor hafalan sekelas. eh malem ini muridnya yg lain yg ngeliat kk ku nangis ke rumah anter coklat ada suratnya https://t.co/0OhY8tyqHV","1753058841921540489","https://pbs.twimg.com/media/GFQdt9dWcAMPkIM.jpg","","in","","3277","1449","4198","https://x.com/sukamiayamaw/status/1753058841921540489","1609314169249222656","sukamiayamaw"
"1731919989475553440","Tue Dec 05 06:14:37 +0000 2023","2674","Bajingan Tolol ini nggak Ketuanya ndak Kadernya sama setelah Menghina jogja justru malah merekan jadikan Candaan... Memang Partai Sampah Indonesia! #TenggelamkanPSIdiJogja #Tenggelamkan02diJogja https://t.co/AQwQNdMLSq","1731919989475553440","https://pbs.twimg.com/media/GAkEDTbboAAGncz.jpg","","in","Yogyakarta, Indonesia","78","520","1062","https://x.com/jogja_menyapa/status/1731919989475553440","1168755491524079616","jogja_menyapa"
"1804067544241991961","Fri Jun 21 08:23:15 +0000 2024","2","tolol lu tolol kalo mau ngetik tuh mikir brok","1804067544241991961","","","in","rps mahae","0","0","0","https://x.com/ecilliec/status/1804067544241991961","1326817530917367808","ecilliec"
"1803390111192666280","Wed Jun 19 11:31:22 +0000 2024","2","Fak DUalingo bangsat napa lu jadi gay hah TOLOL https://t.co/bvcas46VyU","1803390111192666280","https://pbs.twimg.com/media/GQbtvsSaIAMEkVt.png","","in","Surakarta, Jawa Tengah","0","0","0","https://x.com/sonofladydiana/status/1803390111192666280","1314672944476372992","sonofladydiana"
"1790561478107697167","Wed May 15 01:54:58 +0000 2024","8924","BPJS menjadi ikutan Tolol logikanya jika iuran BPJS kemudian harus setara dengan Take Home Pay Peserta pertanyaannya lalu beban Costs of living Peserta Uangnya dari mana. Lalu bagaimana dengan mereka yang Pensiunan atau employee PHK cara bayarnya bagaimana #hening https://t.co/WWZ7t3KlWE","1790561478107697167","https://pbs.twimg.com/media/GNlaLBFbUAEFy6k.jpg","","in","Hazelwood Court, Flinders View","1827","1681","3076","https://x.com/asboediono_id/status/1790561478107697167","780554097388687360","asboediono_id"
"1804161063811977614","Fri Jun 21 14:34:51 +0000 2024","4","Orang nyari skintific mau beli cushion lah malah beli moistirizer tolol (alhamdulillah) https://t.co/4SgKcIpELX","1804161063811977614","https://pbs.twimg.com/media/GQmq7EOakAImf9R.jpg","","in","they're heart","0","2","0","https://x.com/tmnsblmangk_2/status/1804161063811977614","1606465500971962368","tmnsblmangk_2"
"1804060649892560918","Fri Jun 21 07:55:51 +0000 2024","35","PROTECT RENJUN FROM SASAENGS #JusticeForRenjun KERJA TOLOL @SMTOWNGLOBAL https://t.co/5jo5RpBX1g","1804060649892560918","https://pbs.twimg.com/media/GQlPmaFakAIJs3R.jpg","","in","","0","16","17","https://x.com/antarasaa/status/1804060649892560918","1488691716261806082","antarasaa"
"1803660815402205208","Thu Jun 20 05:27:03 +0000 2024","23","apa yg bikin gue gak nyaman udahan tinggal di kuningan? banyak org gila sampe dateng2in gue pas makan di warpad depan pas gue nyalon bahkan selalu dmin gue dengan akun yg berbeda2 anjing lah lo pikir kalo lo ginii gue mau ngentot ma lo tolol? https://t.co/jUhf3FXHii","1803660815402205208","https://pbs.twimg.com/media/GQfj8wKbAAAA_Wc.jpg","","in","DKI Jakarta, Indonesia","0","6","1","https://x.com/GRESAIDZ/status/1803660815402205208","1709816005281951744","GRESAIDZ"
"1804207667738747014","Fri Jun 21 17:40:03 +0000 2024","3","awoakowka kaliann knp gemesin sih plonga plongo kaya tolol https://t.co/8HY4r8JXtf","1804207667738747014","https://pbs.twimg.com/media/GQnVT-0akAMkQU8.jpg","","in","ic: @SP0I0ppp","0","1","0","https://x.com/dottroue/status/1804207667738747014","1490942144840085505","dottroue"
"1804140850341093721","Fri Jun 21 13:14:32 +0000 2024","4","mana nih lonte yang mau direndahin dientot brutal diperkosa sampe tolol dm sini #chatseks #chatsekskasar #chatseks","1804140850341093721","","","in","","0","0","0","https://x.com/randomshttguy/status/1804140850341093721","1517203739354234881","randomshttguy"
"1804148890708681061","Fri Jun 21 15:51:02 +0000 2024","8773","@tanyarlfes Emang rendah. Tugas/skripsi/ujian apapun itu kan harus dikerjakan sendiri ngukur kemampuan otak lu sampe mana. Malah bayar orang. Ya emang pake duit lu sendiri masa pake duit orang lain? Sudah joki bacot bangga sok trying to justify pula. Tolol.","1804180234931195905","","tanyarlfes","in","🌏","20","28","534","https://x.com/OpiumCoca/status/1804180234931195905","1396120835568685060","OpiumCoca"
"1724019468739952651","Mon Nov 13 11:00:46 +0000 2023","6442","kabarnya smpe skrg blm juga di cancel https://t.co/jEXlZyK5np","1724019468739952651","https://pbs.twimg.com/media/F-zyjdybYAADp9k.jpg","","in","","232","420","767","https://x.com/ketololan_tolol/status/1724019468739952651","1286878661493190657","ketololan_tolol"
"1804137652725432743","Fri Jun 21 13:01:50 +0000 2024","2","PUKI2. INI MAH DIJUAL Rp1 JUGA LAKU ANJING. EMG LONTE MEMEK LU MURAHAN TOLOL","1804137652725432743","","","in","indonesia","0","1","0","https://x.com/cqeleste/status/1804137652725432743","1756344199836774401","cqeleste"
"1803748419028357444","Thu Jun 20 11:15:09 +0000 2024","2","TOLOL yg nyenggol chilzen duluan siapa? chilzen ga bakal nimbrung klo ga ada yg bawa2 ilichil blok. https://t.co/Rz68cY5zGw","1803748419028357444","https://pbs.twimg.com/media/GQgzoNybAAAlXDM.jpg","","in","127squad🥂","0","1","0","https://x.com/ceweechanie_/status/1803748419028357444","1720295973401079808","ceweechanie_"
"1803656972564308167","Thu Jun 20 05:11:47 +0000 2024","9","Wajar kalau dinyinyirin soalnya parameter dalam menentukan produk2 yg diboikot nggak jelas Kalau mau boikot berdasarkan signifikansi bantuan yg diberikan perusahaan tersebut kpd israel maka intel google boeing dan aribus akan masuk daftar Boikot kopi &amp; pembalut? Wibu tolol https://t.co/1DqMkmTTzy","1803656972564308167","https://pbs.twimg.com/media/GQfgdQubMAAj2GA.jpg","","in","Universitas Al-Azhab","0","1","5","https://x.com/syekh_kyai_lmao/status/1803656972564308167","1223179827814887425","syekh_kyai_lmao"
"1798326901326729260","Wed Jun 05 12:11:59 +0000 2024","10460","Cuma orang tolol atau kurang waras yang membandingkan Kualitas Udara kota-kota padat penduduk dengan kota di tengah hutan yg belum ada penghuninya. https://t.co/8LNoX9NROf","1798326901326729260","https://pbs.twimg.com/media/GPTwyDxawAA1HzN.jpg","","in","","138","766","2527","https://x.com/DokterTifa/status/1798326901326729260","1502822366946402304","DokterTifa"
"1804069516068163761","Fri Jun 21 08:31:05 +0000 2024","2","Tolol emang gimana bisa sih lo nelfon temen lo yg udh ada di kontak jadi nomor org? Dan itu di imess? Tolol aja masih ada yg percaya atau ga emg haters yg jadiin momen ini kesempatan buat hate artisnya","1804069516068163761","","","in","반딧불🌊","0","0","0","https://x.com/do0space/status/1804069516068163761","1584213365693771776","do0space"
"1764453894032359485","Mon Mar 04 00:52:44 +0000 2024","63131","orang tolol mana yg minta dibangunin tp hpnya disilent","1764453894032359485","","","in","","9461","4756","11885","https://x.com/vesicaafellea/status/1764453894032359485","1528313011051515905","vesicaafellea"
"1717466004782198972","Thu Oct 26 08:59:39 +0000 2023","20125","bukan redflag lebih ke tolol sih https://t.co/SsuKQgstXt","1717466004782198972","https://pbs.twimg.com/media/F9WqOfGaUAAPe2u.jpg","","in","unmagnetism12@gmail.com","353","1028","1986","https://x.com/unmagnetism/status/1717466004782198972","843269533930405888","unmagnetism"
"1765228117420093524","Wed Mar 06 04:09:14 +0000 2024","4996","Februari 2024 dia hina Pak Anies scr tolol krn masalah banjir di UNJ. Maret 2024 dia mewek minta tolong Pak Anies krn Hak KJMU nya dicbut PJ Heru. Apa gak tolol dan memalukan tuh si @unjsecret. Mencret sdh dia sesal kemudian tak ada guna. https://t.co/sJoUYy9kbx","1765228117420093524","https://pbs.twimg.com/media/GH9ZnWnaIAAgTO0.jpg","","in","","180","509","1741","https://x.com/taufik_q/status/1765228117420093524","175752154","taufik_q"
"1800361147826319626","Tue Jun 11 02:55:21 +0000 2024","13373","Kaum Mubazir 58% Dengan Tingkatan Tolol Yang Goblognya Sudah Extraordinary https://t.co/McvWtmlwwn","1800361147826319626","https://pbs.twimg.com/ext_tw_video_thumb/1800160094258380801/pu/img/iTE8FxwAplOLBmUD.jpg","","in","Jakarta","1479","529","3523","https://x.com/Kanseulir/status/1800361147826319626","279312062","Kanseulir"
"1768194185021227422","Thu Mar 14 08:35:19 +0000 2024","18910","orang tolol mana yang minta dibangunin tapi hpnya disilent","1768194185021227422","","","in","","2614","1945","2674","https://x.com/blos00m/status/1768194185021227422","1668094329284628481","blos00m"
"1803676609251340526","Thu Jun 20 06:29:48 +0000 2024","5","Melawan opini tolol dengan stok meme yg tersisa https://t.co/8AkrU4muU3","1803676609251340526","https://pbs.twimg.com/media/GQfyT8maoAA7t7Y.jpg","","in","","0","1","0","https://x.com/minggudesu/status/1803676609251340526","1366971273746604032","minggudesu"
"1718461696363401288","Sun Oct 29 02:56:10 +0000 2023","7203","Yang kaya gini diharapkan ngerti asam folat pre-eclampsia frekuensi USG rumput fatimah? Yang kaya gini diharapkan ngerti IMD pelekatan kolostrum PPD mekonium? Bodo amat dibilang mom shaming apapun emang orang tolol kaya gini ga pantes punya anak.","1718461696363401288","","","in","","202","204","1936","https://x.com/VindhTR/status/1718461696363401288","340284696","VindhTR"
"1803276927425507333","Wed Jun 19 04:01:37 +0000 2024","2","orang tolol https://t.co/iNoll1IV6K","1803276927425507333","https://pbs.twimg.com/media/GQaGzZTaIAEQu7-.jpg","","in","","0","0","0","https://x.com/fieyls/status/1803276927425507333","1209625972183420928","fieyls"
"1803758471822864443","Thu Jun 20 23:42:08 +0000 2024","4247","@denismalhotra emang tolol sih orang-orang gerinda. mau nyari calon dari kalngan seleb biar orang dah pada kenal boleh tapi setidaknya cari yg track record nya bagus dan punya kapabilitas untuk memimpin. si marshel ini jgnkan memimpin sebuah daerah mimpin dirinya sendiri dia gak bisa. https://t.co/wiH5HtoWTJ","1803936401454768302","https://pbs.twimg.com/amplify_video_thumb/1803936315295350784/img/x1CU1BrIXIzLsdkV.jpg","denismalhotra","in","","93","123","625","https://x.com/palingteguh/status/1803936401454768302","781195672116604928","palingteguh"
"1803279880664261085","Wed Jun 19 04:13:38 +0000 2024","12","Teruskan tolol tolol nya https://t.co/PnATyrVccq","1803279949941657809","https://pbs.twimg.com/media/GQaJjtIaIAAEJdH.jpg","AkiraHakimo","in","unknown","0","1","0","https://x.com/AkiraHakimo/status/1803279949941657809","1608173687416721408","AkiraHakimo"
"1804095007198155056","Fri Jun 21 10:12:22 +0000 2024","4","Teruslah ngotot bebel bgt pantes tolol https://t.co/FwYWn2TPHu","1804095007198155056","https://pbs.twimg.com/media/GQlu2TIbsAAL9g5.jpg","","in","","1","2","0","https://x.com/hyuckbear0606/status/1804095007198155056","1337397014997344257","hyuckbear0606"
"1755806848022904990","Fri Feb 09 04:12:28 +0000 2024","34371","Yang bener yang mana nih Moy? 1. Besama Indonsa Indonieii Majuu 2. Bersama Indonieii Indonsaa Majuu Makan tuh AI tolol https://t.co/gyQ3LopDqm","1755806848022904990","https://pbs.twimg.com/media/GF3gvXOaYAA8NJY.png","","in","Behind GM's Screen","825","364","5670","https://x.com/SoundOfYogi/status/1755806848022904990","93882850","SoundOfYogi"
"1804206784384766384","Fri Jun 21 17:36:32 +0000 2024","3","Hanya Bangsa-Bangsa Tolol yang mau di jajah budayanya..!!!!","1804206784384766384","","","in","","0","1","0","https://x.com/Opiniku95098012/status/1804206784384766384","1645282016706064384","Opiniku95098012"
"1787473043868303795","Mon May 06 13:22:37 +0000 2024","4894","wkwk liga tolol https://t.co/75Epm9ssGr","1787473043868303795","https://pbs.twimg.com/amplify_video_thumb/1787472990411878400/img/6OUkp-YrGIDksI5R.jpg","","in","Indonesia","360","948","1515","https://x.com/txtdarigajelass/status/1787473043868303795","1316441034117718016","txtdarigajelass"
"1804075113706590373","Fri Jun 21 08:53:19 +0000 2024","23","lo marah ke SMonyet mah marah aja anjing ngapain pake segala bawa2 rumor laknat yg udh jelas2 itu pencemaran nama baik goblok. ya pantes SM ngebantah wong artisnya difitnah &amp; sama sekali gak ngelakuin? cuma orang tolol yg kepengen biasnya dapet rumor biar dilindungin agenshitot","1804075113706590373","","","in","","0","0","4","https://x.com/SOLEILE0S/status/1804075113706590373","1722167136532205568","SOLEILE0S"
"1804079449467769221","Fri Jun 21 09:10:33 +0000 2024","6","modelan setan yg kayak begini nih yg bikin orang tadinya masih respect sama biasnya ngebantu naikin ht secara sukarela karena pengen masalah rj cepet kelar tapi grgr kelakuan fans tolol gak tau dirinya jadi bikin orang makin males makin nyesel. gws deh lo najis","1804079449467769221","","","in","","0","0","2","https://x.com/SOLEILE0S/status/1804079449467769221","1722167136532205568","SOLEILE0S"
"1804169026731675737","Fri Jun 21 15:06:30 +0000 2024","4","tolol nya kronis bgt ni orang heran bgt gua di pelihara","1804169026731675737","","","in","","0","0","0","https://x.com/huhpusink/status/1804169026731675737","1418911556373565447","huhpusink"
"1772435289819992182","Tue Mar 26 01:27:58 +0000 2024","7834"," tuh buktinya dia ngechat gue lagi ya buat ngecek lo masih tolol apa engga anjir jan bangga","1772435289819992182","","","in","","586","473","1791","https://x.com/emilmarioo/status/1772435289819992182","1128537802046468101","emilmarioo"
"1804009724687560974","Fri Jun 21 04:33:29 +0000 2024","8","GOBLOK TOLOL SUMPAH. SIAPA YG KMREN NYURUH GW BUILD HIMEKO BREAK?????? TOLOL BANGET GW SELAMA MAIN CEKIKIKAN DEMEGNYA 100 100 100 MAKASIH AWALNYA 19 TURN JADI 23 TURN https://t.co/03iVLW1XpD","1804009724687560974","https://pbs.twimg.com/media/GQkhSMFakAEQbe4.jpg","","in","ygk","1","9","0","https://x.com/Arihaitham/status/1804009724687560974","1794249687639412736","Arihaitham"
"1803800015065985525","Thu Jun 20 14:40:11 +0000 2024","4","bisa dapet krn rela nganter sana sini pulang yg 5 jam total pp jemput anytime anywhere dengerin aku nangisin mantan (tolol si ini aku malu smpe skrng) curhat soal hts an ku yg pada ilang wkwkek dan terus terusan mencoba mengerti manusia manipulatif inihhhh https://t.co/w8S7Z7SpoA","1803800015065985525","https://pbs.twimg.com/media/GQhijgvbMAACLNs.jpg","","in","Sidoarjo, Indonesia","0","1","0","https://x.com/mngyuugf/status/1803800015065985525","1563204834203168768","mngyuugf"
"1757027089482650100","Mon Feb 12 13:01:16 +0000 2024","7695","Anak tolol jadi Ketua partai ya begini ini kelakuannya. Segala aturan ditabrak cengar cengir cengengesan. Mending pake behel ini kagak! https://t.co/YqmIRW8SWQ","1757027089482650100","https://pbs.twimg.com/media/GGI2024bgAAW4l4.jpg","","in","","114","1015","1968","https://x.com/DokterTifa/status/1757027089482650100","1502822366946402304","DokterTifa"
"1803962342948114840","Fri Jun 21 01:25:13 +0000 2024","2","KNET LU WARAS????????! AGENCY NYA AJA KAGA GERAK TOLOL GIMANA MAU NGAJUIN GUGATAN! https://t.co/4T673S1vGx","1803962342948114840","https://pbs.twimg.com/media/GQj2L9iagAApibW.jpg","","in","rjphobicdni❗️","0","2","0","https://x.com/cjenoleee/status/1803962342948114840","1720332788128448512","cjenoleee"
"1803867209607057430","Thu Jun 20 19:07:11 +0000 2024","4","SCAMMER TOLOL MASUK NERAKA JALUR SCAMM ORANG 6K SEENGAK MAMPU ITUKAH LU ANJG AMPE SCAM 6K GW BARU NGEUH KL NO SHOPEPAYNYA DITARIK No scammer 083181066460 Scammer jasa edit foto fakkmen #zonauang #scammer #scam https://t.co/ozdc6BdwAh","1803867209607057430","https://pbs.twimg.com/media/GQifp0ZakAANYgf.jpg","","in","","0","2","9","https://x.com/sunkissedboyhae/status/1803867209607057430","1708010173829443584","sunkissedboyhae"
"1779465156327879126","Sun Apr 14 11:02:08 +0000 2024","6061","Viralin ️ PRANK TOLOL Disini si cowo diprank pas lagi dapet orderan bahkan sampe dicancel. Dia gk izin dia juga bilang gk akan diupload. si abang minta takedown karna merasa gk nyaman tapi cuman disuruh sabar. gak kebayang klo disitu beneran ada sumbu pendek dan main pukul https://t.co/EXxPDsf412","1779465156327879126","https://pbs.twimg.com/ext_tw_video_thumb/1779465084642934784/pu/img/y3ruLCqf6kCgG_r8.jpg","","in","","515","1257","1704","https://x.com/bacottetangga_/status/1779465156327879126","2328193494","bacottetangga_"
"1781158873510064454","Fri Apr 19 03:12:22 +0000 2024","17285","Bodoh. Semua orang tahu bahwa vagina itu rapet saat klimaks karena serviksnya sedang nyedot semua peju. Kamu gapernah baca hentai ya? Tolol. Tidak berbudaya.","1781158873510064454","","","in","1997","1339","384","2577","https://x.com/pukimaxxing/status/1781158873510064454","1720875815553175552","pukimaxxing"
"1782961619561279870","Wed Apr 24 02:35:50 +0000 2024","7458"," sombong banget si dichat gaperna dibales UDAH TAU SOMBONG MASIH CHAT TRS KAN TOLOL","1782961619561279870","","","in","Jawa Timur, Indonesia","135","196","1979","https://x.com/ahcegil/status/1782961619561279870","1395612149263732737","ahcegil"
